{
  "artifact_identity": null,
  "command_or_procedure": "pytest -q --adc-evidence tests/test_common_request.py::test_common_request_preserves_adapter_neutral_user_intent tests/test_common_request.py::test_common_requests_do_not_share_project_info_defaults tests/test_requirement_lineage.py::TestRequirementLineageThroughS23 tests/test_diagnostic_evidence.py tests/test_central_diagnostic_trace.py::test_secret_redaction_and_detail_allowlist_protect_persisted_jsonl tests/test_central_diagnostic_trace.py::test_trace_content_cannot_approve_or_release_publish_gate",
  "duration": 0.000723,
  "environment": {
    "os": "Linux",
    "platform": "Linux-7.0.0-31-generic-x86_64-with-glibc2.39",
    "profile": null,
    "testbed": "pytest"
  },
  "event_id": "EVT-0020",
  "evidence_payload": {
    "longrepr": null,
    "outcome": "passed"
  },
  "exit_code": null,
  "mapped_test_id": null,
  "producer": "ADC",
  "raw_output_reference": null,
  "repository_identity": {
    "commit": "072aab394d2ee987f29c2b5c6c3b2936eea59ae5",
    "dirty": true,
    "worktree": "/home/udo/AI-Dev-Center"
  },
  "result": "IO",
  "run_id": "ADC-RUN-20260918T152513Z-a5e0638b",
  "schema_version": "1.0",
  "test_selector": "tests/test_diagnostic_evidence.py::test_very_large_command_evidence_is_bounded_on_the_legacy_single_result_path",
  "timestamp_end": "2026-09-18T15:25:13.504748+00:00",
  "timestamp_start": "2026-09-18T15:25:13.504405+00:00",
  "tool_versions": {
    "pytest": "9.1.1",
    "python": "3.12.3"
  }
}
